{
  "version": 1,
  "schema": "libs/runtime-manifest/schemas/manifest/runtime.v1.schema.json",
  "name": "examples-all-fixtures",
  "description": "Example echo agent with echo fixture for dev:once --list.",
  "agents": [
    {
      "name": "example-echo",
      "handler": "examples/agents/example-agent-echo/src/echo-agent.ts",
      "handles": ["example.ping.v1"],
      "fixtures": {
        "webhook": [
          "examples/fixtures/example-agent-echo/echo.fixture.json"
        ],
        "adapter": []
      }
    }
  ],
  "webhooks": {
    "routes": [
      "synapse.webhooks.example-echo-ping.v1",
      "synapse.webhooks.example-notifier-ticket.v1"
    ]
  }
}
